{
  "schema_version": 1,
  "run_id": "simulation-tutorfollowup-20260914",
  "status": "complete",
  "scope": {
    "id": "tutorfollowup-us",
    "revision": 1,
    "buyer": "US independent tutors",
    "pain": "missed payment follow-up",
    "solution": "automated reminders"
  },
  "operator": {
    "skills": "solo developer",
    "hours_per_week": 5,
    "monthly_budget_usd": 100,
    "access": "12 tutor contacts (simulation)",
    "goal": "part-time viability is provisional; no income target supplied"
  },
  "criteria": [
    {
      "id": "pain",
      "threshold": "At least 3 independent buyers report a recurring missed-payment problem with a concrete consequence in last 90 days.",
      "evidence": "Dated buyer accounts with frequency, consequence, and source independence.",
      "recorded_at": "2026-09-15T04:06:42.873146+00:00",
      "exposure": "Before report conclusions; synthetic fixture facts already supplied, so not blind preregistration. Researcher-proposed provisional bars; no revisions."
    },
    {
      "id": "reachable_buyers",
      "threshold": "At least 10 relevant US independent tutors are credibly contactable.",
      "evidence": "Operator access plus confirmation of relevance and geography; contactability is not conversion.",
      "recorded_at": "2026-09-15T04:06:42.873153+00:00",
      "exposure": "Before report conclusions; synthetic fixture facts already supplied, so not blind preregistration. Researcher-proposed provisional bars; no revisions."
    },
    {
      "id": "economics",
      "threshold": "At least 2 relevant buyers commit to a tested price and conservative positive monthly contribution fits USD 100/month cap.",
      "evidence": "Price commitments; measured variable and support costs; acquisition effort.",
      "recorded_at": "2026-09-15T04:06:42.873155+00:00",
      "exposure": "Before report conclusions; synthetic fixture facts already supplied, so not blind preregistration. Researcher-proposed provisional bars; no revisions."
    },
    {
      "id": "operator_fit",
      "threshold": "Pilot delivery plus support and selling fits 5 hours/week and USD 100/month.",
      "evidence": "Timed pilot task and conservative support/sales workload.",
      "recorded_at": "2026-09-15T04:06:42.873156+00:00",
      "exposure": "Before report conclusions; synthetic fixture facts already supplied, so not blind preregistration. Researcher-proposed provisional bars; no revisions."
    },
    {
      "id": "timing",
      "threshold": "A current purchase trigger or dated enabling change with a credible reason to act now.",
      "evidence": "Dated buyer trigger or primary evidence of changed constraint.",
      "recorded_at": "2026-09-15T04:06:42.873157+00:00",
      "exposure": "Before report conclusions; synthetic fixture facts already supplied, so not blind preregistration. Researcher-proposed provisional bars; no revisions."
    },
    {
      "id": "unacceptable_risks",
      "threshold": "No demonstrated unmitigable consent, privacy, or delivery blocker for the proposed pilot.",
      "evidence": "Reviewed minimal data flow, permissions and delivery design; unknown is not cleared.",
      "recorded_at": "2026-09-15T04:06:42.873159+00:00",
      "exposure": "Before report conclusions; synthetic fixture facts already supplied, so not blind preregistration. Researcher-proposed provisional bars; no revisions."
    }
  ],
  "decisions": [
    {
      "at": "2026-09-15T04:06:42.873161+00:00",
      "authority": "supplied operator fixture",
      "decision": "Evaluate TutorFollowup; keep buyer, pain, solution, geography fixed. All research authorized; commits no; wedge and continuation delegated; pivots not delegated. Offline installed sources expressly authorized."
    },
    {
      "at": "2026-09-15T04:06:42.898667+00:00",
      "authority": "operator selection",
      "decision": "Revalidate scan for fixed TutorFollowup scope; proceed without candidate switch."
    },
    {
      "at": "2026-09-15T04:06:43.038011+00:00",
      "authority": "explicit operator delegation",
      "decision": "Continue remaining research; gather missing evidence recommendation does not authorize outward tests or pivot."
    },
    {
      "at": "2026-09-15T04:06:43.220740+00:00",
      "authority": "explicit operator delegation",
      "decision": "Select provisional payment-follow-up wedge within existing scope before 66\u201367."
    },
    {
      "at": "2026-09-15T04:10:06.262357+00:00",
      "authority": "explicit parent review-fix task within authorized simulation",
      "decision": "Archive originals; repair local Niche test criteria; mark 62\u201367 stale and revalidate sequentially. Scope and original bars unchanged: this is an input-change recovery, not a pivot."
    },
    {
      "at": "2026-09-15T04:10:06.464563+00:00",
      "authority": "authorized research continuation and review repair",
      "decision": "Brief 62 explicitly revalidated: Niche local interview criteria match existing Demand test: 3 recent recurring-consequence accounts and 2 price commitments. No new testimony or spending proof; demand remains unknown."
    },
    {
      "at": "2026-09-15T04:10:06.567747+00:00",
      "authority": "authorized research continuation and review repair",
      "decision": "Brief 63 explicitly revalidated: Added interview plan supplies no competitor facts, adoption, or weak-supply evidence; gap classification remains unknown."
    },
    {
      "at": "2026-09-15T04:10:06.667066+00:00",
      "authority": "authorized research continuation and review repair",
      "decision": "Brief 64 explicitly revalidated: Added local thresholds do not change network size, geography uncertainty, conversion assumptions or timing; scenario arithmetic unchanged."
    },
    {
      "at": "2026-09-15T04:10:06.759518+00:00",
      "authority": "authorized research continuation and review repair",
      "decision": "Brief 65 explicitly revalidated: Added questions retain buyer/pain/product/geography and calendar counterevidence. Existing delegated provisional wedge selection remains applicable; no pivot."
    },
    {
      "at": "2026-09-15T04:10:06.847190+00:00",
      "authority": "authorized research continuation and review repair",
      "decision": "Brief 66 explicitly revalidated: Added tests do not measure willingness to pay, variable costs, labor or consent; economics assumptions and ranked risk tests remain provisional."
    },
    {
      "at": "2026-09-15T04:10:06.942630+00:00",
      "authority": "authorized research continuation and review repair",
      "decision": "Brief 67 explicitly revalidated: Rechecked all six unchanged bars against refreshed prior reports; proposed interviews are not executed evidence. All six remain unknown and ruling remains insufficient evidence."
    },
    {
      "at": "2026-09-15T04:12:41.238116+00:00",
      "authority": "explicit parent fresh-session review repair task",
      "decision": "Archive current originals; mark 60\u201367 stale; add proposed local test thresholds and timing gate, then revalidate sequentially. No new evidence, scope change or bar revision."
    },
    {
      "at": "2026-09-15T04:12:41.331270+00:00",
      "authority": "authorized research continuation and explicit review repair",
      "decision": "Brief 60 revalidated: Added local pain/access success criteria and bounded stop rules from original bars; no new candidate or evidence."
    },
    {
      "at": "2026-09-15T04:12:41.418718+00:00",
      "authority": "authorized research continuation and explicit review repair",
      "decision": "Brief 61 revalidated: Reviewed revised Opportunity test against local Niche questions and thresholds: aligned; fixed scope and access uncertainty unchanged."
    },
    {
      "at": "2026-09-15T04:12:41.517996+00:00",
      "authority": "authorized research continuation and explicit review repair",
      "decision": "Brief 62 revalidated: Reviewed upstream local thresholds: unchanged pain/spend bars and shared batch. Complaints still do not establish willingness to pay."
    },
    {
      "at": "2026-09-15T04:12:41.615911+00:00",
      "authority": "authorized research continuation and explicit review repair",
      "decision": "Brief 63 revalidated: Added bounded calendar-sufficiency definitions and provisional test thresholds; no observed competitor or buyer evidence added. Gap remains unknown."
    },
    {
      "at": "2026-09-15T04:12:41.705015+00:00",
      "authority": "authorized research continuation and explicit review repair",
      "decision": "Brief 64 revalidated: Reviewed revised test plans: no new counts, conversions, price acceptance or dates; market scenarios and timing uncertainty unchanged."
    },
    {
      "at": "2026-09-15T04:12:41.796384+00:00",
      "authority": "authorized research continuation and explicit review repair",
      "decision": "Brief 65 revalidated: Reviewed refined gap test: it proposes evidence collection only; fixed provisional wedge remains selected under existing delegation, no pivot."
    },
    {
      "at": "2026-09-15T04:12:41.899802+00:00",
      "authority": "authorized research continuation and explicit review repair",
      "decision": "Brief 66 revalidated: Reviewed refined upstream tests: no measured costs, adoption or defense; economics/fit uncertainty and model assumptions remain unchanged."
    },
    {
      "at": "2026-09-15T04:12:42.021365+00:00",
      "authority": "authorized research continuation and explicit review repair",
      "decision": "Brief 67 revalidated: Added timing follow-up within the existing first experiment and explicit unknown-timing gate. Original six bars unchanged; all remain unknown, ruling remains insufficient evidence."
    }
  ],
  "commit_preference": "no",
  "next_step": "Present insufficient-evidence ruling; obtain operator response on accepting it or challenging a bar. Any outreach requires explicit authorization.",
  "stages": [
    {